{
  "expected": {
    "checks": [
      "alive_phase_observed",
      "all_samples_processed",
      "bomb_release_pulse_observed",
      "critical_overspeed_observed",
      "cycle_rollover_observed",
      "landing_observed",
      "lobby_endpoint_failures_observed",
      "player_loss_observed",
      "refit_observed",
      "two_takeoffs_observed"
    ],
    "landings_sec": [
      634.250392
    ],
    "lobby_endpoint_failures": 132,
    "max_cycle": 2,
    "max_sortie_id": 2,
    "player_losses_sec": [
      1057.500077
    ],
    "refits_sec": [
      665.000493
    ],
    "takeoffs_sec": [
      63.250632,
      682.750773
    ],
    "weapon2_pulse_count": 13
  },
  "fixture_id": "full-sortie-20260710",
  "fixture_version": 1,
  "privacy": {
    "coordinates_preserved": true,
    "profile": "raw-official-8111-v1",
    "recorder_identity_fields_omitted": true
  },
  "session_file": "full_sortie_20260710.jsonl.gz",
  "session_sha256": "c00a3beb1c9e4b4c6a4e35fbce3cea86e70ff2155e44442edd07a914cedb8805",
  "source": {
    "duration_sec": 1078.477104,
    "recording_sha256": "c00a3beb1c9e4b4c6a4e35fbce3cea86e70ff2155e44442edd07a914cedb8805",
    "samples": 4281,
    "started_at_utc": "2026-07-10T11:06:39.721Z"
  }
}
